{
 "$schema": "https://json-schema.org/draft/2020-12/schema",
 "$id": "teoria-blocchi/1",
 "title": "teoria-blocchi/1: the Teoria pages cut into citable blocks",
 "description": "Written by `teoria-blocchi DIR OUT` (crates/mzlab-tutor). Canonical: keys in alphabetical order, one block per line, same bytes for the same pages. Exercise blocks (kind esercizio) hold only the question; the hidden answer appears as a SHA and as hashed 5-word shingles, never as text.",
 "type": "object",
 "required": ["blocks", "chapters", "n", "schema"],
 "additionalProperties": false,
 "properties": {
  "schema": {"const": "teoria-blocchi/1"},
  "n": {"type": "integer", "minimum": 0},
  "chapters": {"type": "object", "description": "page name (without .html) -> title of the page", "additionalProperties": {"type": "string"}},
  "blocks": {
   "type": "array",
   "items": {
    "type": "object",
    "required": ["anchor", "chapter", "file", "id", "kind", "sha", "text", "title"],
    "additionalProperties": false,
    "properties": {
     "id": {"type": "string", "description": "file#anchor.k, k = order of the block under that anchor", "pattern": "^[^#]+#[^#]*\\.[0-9]+$"},
     "file": {"type": "string", "description": "page name without .html"},
     "anchor": {"type": "string", "description": "id of the heading or glossary term the block sits under; empty before the first h2"},
     "chapter": {"type": "string", "description": "kicker of the page (\"Capitolo 12\"), or its title when it has none"},
     "title": {"type": "string", "description": "title of the section (h2/h3), or the glossary term"},
     "kind": {"enum": ["testo", "glossario", "figura", "esercizio"]},
     "text": {"type": "string", "maxLength": 1200},
     "sha": {"type": "string", "pattern": "^[0-9a-f]{12}$", "description": "first 12 hex digits of the SHA-256 of the normalised text"},
     "hidden_sha": {"type": "string", "pattern": "^[0-9a-f]{12}$", "description": "same for the hidden answer (esercizio only)"},
     "hidden_shingles": {"type": "array", "uniqueItems": true, "items": {"type": "string", "pattern": "^[0-9a-f]{6}$"}, "description": "sorted 6-hex hashes of the 5-word shingles of the hidden answer"}
    }
   }
  }
 }
}
