{"blocks":[
{"anchor":"filtro","chapter":"Capitolo 9","file":"09-quadrupolo","id":"09-quadrupolo#filtro.1","kind":"testo","sha":"72d75e033e6e","text":"Il filtro lascia passare in ogni istante solo gli ioni con un m/z dentro una finestra stretta. Con la risoluzione unitaria la finestra è larga circa 0,7 Da a metà altezza.\nGli altri ioni hanno traiettorie instabili e finiscono sulle barre. Per questo in scansione la sensibilità è bassa.","title":"Un filtro di massa"},
{"anchor":"stabilita","chapter":"Capitolo 9","file":"09-quadrupolo","id":"09-quadrupolo#stabilita.1","kind":"testo","sha":"36deaffda5a8","text":"Uno ione è trasmesso se i suoi parametri a e q cadono nella regione di stabilità. Con a = 0 il limite è q = 0,908.","title":"Regione di stabilità"},
{"anchor":"verifica","chapter":"Capitolo 9","file":"09-quadrupolo","hidden_sha":"b5e1c674dcaf","hidden_shingles":["09b9ab","0de930","0ea5cb","10c6a8","11fabc","1ba316","2667bd","2b2bd7","3cc99d","3f13f9","4ef249","637e49","904b3f","9d4322","a7120b","ce783b","e301b7","fd0b7d"],"id":"09-quadrupolo#verifica.1","kind":"esercizio","sha":"1725419e96f7","text":"Uno ione con a = 0 e q = 0,95 è trasmesso?","title":"Verifica"},
{"anchor":"metodo","chapter":"Capitolo 12","file":"12-dati","id":"12-dati#metodo.1","kind":"testo","sha":"116b03764cac","text":"Un cromatogramma estratto mostra l'intensità di un solo m/z in funzione del tempo di ritenzione. Si confronta sempre il campione con il bianco prima di dire che un picco è reale.\nA risoluzione unitaria un m/z è un candidato, non un'identificazione: servono il tempo di ritenzione e lo spettro MS2.","title":"Metodo di lettura"},
{"anchor":"passi","chapter":"Capitolo 18","file":"18-strategia","id":"18-strategia#passi.1","kind":"testo","sha":"062a850bde65","text":"Si parte dal genitore, si cercano le masse attese dalle trasformazioni plausibili e si controlla ogni candidato nel tempo e nello spettro. Le conclusioni vanno scritte dagli studenti nella relazione.","title":"I passi"},
{"anchor":"addotti","chapter":"Capitolo 20","file":"20-esi","id":"20-esi#addotti.1","kind":"testo","sha":"2e195ec753da","text":"In modalità positiva molte molecole danno lo ione [M+H]+. Con sodio compare anche [M+Na]+, 22 unità sopra.","title":"Addotti"},
{"anchor":"g-addotto","chapter":"Capitolo 20","file":"20-esi","id":"20-esi#g-addotto.1","kind":"glossario","sha":"bcb4624c5445","text":"Addotto: Ione formato dalla molecola insieme a un catione come H+ o Na+.","title":"Addotto"}
],"chapters":{"09-quadrupolo":"Il filtro quadrupolare","12-dati":"Leggere i dati del laboratorio","18-strategia":"La strategia di analisi","20-esi":"La ionizzazione electrospray"},"n":7,"schema":"teoria-blocchi/1"}
